{
  "$schema": "https://json-schema.org/draft/2020-12/schema",
  "$id": "schemas/plan-state.schema.json",
  "title": "PlanState",
  "description": "Live coordination state for the Valory orchestrator. Mirrors the work-decomposition tree's runtime: the task DAG, per-task status, dispatched workers, result-file pointers, and the optional File/Unit implementation grain. Persisted at plan/state.json so a long-running orchestrator survives compaction. See docs/agentic-architecture.md.",
  "type": "object",
  "required": ["mission", "current_phase", "tasks"],
  "additionalProperties": false,
  "properties": {
    "mission": {
      "type": "string",
      "minLength": 10,
      "description": "One-line statement of the root ask this effort serves (mirror of plan/root.md)."
    },
    "current_phase": {
      "type": "string",
      "description": "The sprint or phase currently being executed (e.g. 'G1-S1 (Sprint 25)')."
    },
    "updated_at": {
      "type": "string",
      "format": "date-time",
      "description": "Timestamp of the last reconciliation of this state against the plan tree."
    },
    "tasks": {
      "type": "array",
      "description": "The task DAG. Each entry is a level-3 task with its scheduling and acceptance state, optionally grained into Files (5a) and Units (5b).",
      "items": {
        "type": "object",
        "required": ["id", "title", "sprint", "status"],
        "additionalProperties": false,
        "properties": {
          "id": {
            "type": "string",
            "pattern": "^G[0-9]+-S[0-9]+-T[0-9]+$",
            "description": "Canonical task id in the form G<goal>-S<sprint>-T<task> (e.g. G1-S1-T1)."
          },
          "title": {
            "type": "string",
            "minLength": 3,
            "description": "Short description of the deliverable."
          },
          "sprint": {
            "type": "string",
            "pattern": "^G[0-9]+-S[0-9]+$",
            "description": "The sprint this task belongs to (e.g. G1-S1)."
          },
          "status": {
            "type": "string",
            "enum": ["pending", "in-progress", "done", "blocked", "failed"],
            "description": "Lifecycle status. A task with unresolved depends_on is not dispatchable."
          },
          "depends_on": {
            "type": "array",
            "items": { "type": "string", "pattern": "^G[0-9]+-S[0-9]+-T[0-9]+$" },
            "uniqueItems": true,
            "description": "Task ids that must reach status 'done' before this task is dispatchable."
          },
          "assigned_worker": {
            "type": ["string", "null"],
            "description": "The contributor agent dispatched against this task (e.g. senior-engineer), or null if unassigned."
          },
          "verifier": {
            "type": "string",
            "description": "The acceptance gate(s) for this task (e.g. 'SQE + Systems Engineer')."
          },
          "artifact_path": {
            "type": ["string", "null"],
            "description": "Pointer to the worker's result — an artifact directory or the source paths touched. Null until produced."
          },
          "acceptance": {
            "type": "string",
            "enum": ["pending", "pass", "fail"],
            "description": "Verdict from the review pipeline (the level-4 acceptance facet)."
          },
          "requirements": {
            "type": "array",
            "items": { "type": "string", "pattern": "^REQ-[A-Z]+-[0-9]{3}$" },
            "uniqueItems": true,
            "description": "Requirement IDs this task implements, for traceability."
          },
          "blockers": {
            "type": "string",
            "description": "Why this task is blocked or failed, if applicable."
          },
          "files": {
            "type": "array",
            "description": "Optional level-5a implementation grain: the task decomposed into File nodes, one per source file it creates or edits. Present only when a task spans multiple files; a single-file task needs no entries here. Dispatching one worker per File makes 'no two workers edit the same file' structural. A File is finer than a Go-package 'module' (a module contains many Files).",
            "items": {
              "type": "object",
              "required": ["id", "path"],
              "additionalProperties": false,
              "properties": {
                "id": {
                  "type": "string",
                  "pattern": "^G[0-9]+-S[0-9]+-T[0-9]+-F[0-9]+$",
                  "description": "Canonical File id in the form <task>-F<NN> (e.g. G1-S1-T1-F01)."
                },
                "path": {
                  "type": "string",
                  "description": "The single source file this File node realizes (e.g. internal/admin/oversight_handler.go)."
                },
                "status": {
                  "type": "string",
                  "enum": ["pending", "in-progress", "done", "blocked", "failed"],
                  "description": "Lifecycle status of this File's implementation."
                },
                "assigned_worker": {
                  "type": ["string", "null"],
                  "description": "The worker dispatched against this File, or null if unassigned. One worker per File."
                },
                "units": {
                  "type": "array",
                  "description": "Optional level-5b grain: the File decomposed into Unit nodes, one per coherent chunk (a function, type, handler, migration block, test group, or include:: section). The smallest reviewable piece.",
                  "items": {
                    "type": "object",
                    "required": ["id", "title"],
                    "additionalProperties": false,
                    "properties": {
                      "id": {
                        "type": "string",
                        "pattern": "^G[0-9]+-S[0-9]+-T[0-9]+-F[0-9]+-U[0-9]+$",
                        "description": "Canonical Unit id in the form <file>-U<MM> (e.g. G1-S1-T1-F01-U01)."
                      },
                      "title": {
                        "type": "string",
                        "minLength": 3,
                        "description": "Short description of the chunk this Unit realizes."
                      },
                      "requirements": {
                        "type": "array",
                        "items": { "type": "string", "pattern": "^REQ-[A-Z]+-[0-9]{3}$" },
                        "uniqueItems": true,
                        "description": "Requirement IDs this Unit satisfies, for chunk-level traceability."
                      },
                      "acceptance": {
                        "type": "string",
                        "enum": ["pending", "pass", "fail"],
                        "description": "Verdict for this Unit from the review pipeline."
                      }
                    }
                  }
                }
              }
            }
          }
        }
      }
    },
    "discovery": {
      "type": "array",
      "description": "Optional index of discovery passes (docs/discovery-phase.md). One entry per tree node (root/goal/sprint/task) that ran a discovery pass before being decomposed. The heavy DFS detail lives in plan/discovery/<node>/frontier.json (schemas/discovery-frontier.schema.json); this is only the pointer. A node is NOT decomposable while its entry's status is 'discovering', 'gated', or 'escalated' — only 'done' clears the gate, the same way unresolved depends_on blocks dispatch.",
      "items": {
        "type": "object",
        "required": ["node", "status", "path"],
        "additionalProperties": false,
        "properties": {
          "node": {
            "type": "string",
            "pattern": "^(root|G[0-9]+|G[0-9]+-S[0-9]+|G[0-9]+-S[0-9]+-T[0-9]+)$",
            "description": "The tree node this discovery pass serves (matches the frontier's 'node')."
          },
          "status": {
            "type": "string",
            "enum": ["discovering", "gated", "done", "escalated"],
            "description": "Mirrors the frontier's status. Only 'done' makes the node decomposable."
          },
          "path": {
            "type": "string",
            "description": "Directory holding the pass (e.g. plan/discovery/G2-S3/)."
          },
          "gate": {
            "type": "string",
            "enum": ["pending", "pass", "fail"],
            "description": "The discovery-gate verdict (groundedness + coverage); 'done' status requires 'pass'."
          }
        }
      }
    }
  }
}
